31/07/2013,MARIA RODRIGUEZ JAIME,DNI 40936897,PARTICULAR,VISITA PERSONAL,ELA MARIA LUDEÑA COBIAN DE GARCIA,[CAS],DESPACHO MINISTERIAL,16:40,
31/07/2013,MARIA RODRIGUEZ JAIME,DNI 40936897,PARTICULAR,VISITA PERSONAL,ELA MARIA LUDEÑA COBIAN DE GARCIA,[CAS],DESPACHO MINISTERIAL,16:40,
31/07/2013,JHOEL LOPEZ BLAS,DNI 44280266,PARTICULAR,VISITA PERSONAL,OLGA SHIMASAKI OKADA,[DIRECTORA],DIRECCION DE ELENCOS NACIONALES,14:03,
31/07/2013,JHOEL LOPEZ BLAS,DNI 44280266,PARTICULAR,VISITA PERSONAL,OLGA SHIMASAKI OKADA,[DIRECTORA],DIRECCION DE ELENCOS NACIONALES,14:03,
31/07/2013,RODOLFO ZAPATA NUÑEZ,DNI 45674417,PARTICULAR,PROVEEDOR DE BIENES Y/O SERVICIOS,SANDRO JESUS VALVERDE TRUJILLO,[CAS],OFICINA DE OPERACIONES,09:53,
31/07/2013,RODOLFO ZAPATA NUÑEZ,DNI 45674417,PARTICULAR,PROVEEDOR DE BIENES Y/O SERVICIOS,SANDRO JESUS VALVERDE TRUJILLO,[CAS],OFICINA DE OPERACIONES,09:53,
